{"$schema":"https://json-schema.org/draft/2020-12/schema","$id":"https://example.org/scientific-object-continuity-record.schema.json","title":"Scientific-Object Continuity Record","description":"Claim-specific record for an original/replacement wildfire data-object comparison; not a dataset score or generic decision rule.","type":"object","required":["record_version","claim_id","claim_requested","scientific_use","original_object","replacement_object","required_relations","observed_relations","continuity_state","licensed_statement","prohibited_escalation","reason","minimal_repair","provenance"],"properties":{"record_version":{"type":"string"},"claim_id":{"type":"string"},"claim_requested":{"type":"string"},"scientific_use":{"type":"string"},"original_object":{"$ref":"#/$defs/scientificObject"},"replacement_object":{"$ref":"#/$defs/scientificObject"},"required_relations":{"type":"array","items":{"type":"string"},"minItems":1,"uniqueItems":true},"observed_relations":{"type":"array","items":{"$ref":"#/$defs/relationState"},"minItems":1},"continuity_state":{"enum":["same_question_preserved","preserved_with_qualification","question_changed","pending_evidence"]},"pcae":{"type":["object","null"],"properties":{"necessity":{"enum":[0,1]},"possibility":{"enum":[0,1]},"interpretation":{"type":"string"}},"required":["necessity","possibility","interpretation"],"additionalProperties":false},"licensed_statement":{"type":"string"},"prohibited_escalation":{"type":"string"},"reason":{"type":"string"},"minimal_repair":{"type":"array","description":"Inclusion-minimal missing evidence roles/relations under the registered monotone rule; not a cost ranking.","items":{"type":"array","items":{"type":"string"},"minItems":1,"uniqueItems":true}},"downstream_consequence":{"type":"string"},"provenance":{"type":"object","required":["baseline","source_keys","hash_status"],"properties":{"baseline":{"type":"string"},"source_keys":{"type":"array","items":{"type":"string"}},"source_versions":{"type":"array","items":{"type":"string"}},"source_hashes":{"type":"array","items":{"type":"string"}},"hash_status":{"enum":["verified","partial","not_supplied"]}},"additionalProperties":false}},"$defs":{"scientificObject":{"type":"object","required":["target","construct","geographic_domain","temporal_domain","support","event_universe","unit"],"properties":{"target":{"type":"string"},"construct":{"type":"string"},"geographic_domain":{"type":"string"},"temporal_domain":{"type":"string"},"support":{"type":"string"},"event_universe":{"type":"string"},"unit":{"type":"string"},"source_identity":{"type":"string"},"version":{"type":"string"}},"additionalProperties":false},"relationState":{"type":"object","required":["relation","state","evidence"],"properties":{"relation":{"type":"string"},"state":{"enum":["verified","unresolved","failed","not_applicable"]},"evidence":{"type":"string"}},"additionalProperties":false}},"additionalProperties":false}
