[{"record_version":"SOCR-0.1","claim_id":"FR-B06a-MATCHED","claim_requested":"The alternative EFFIS value provides robustness evidence for the registered selected-fire burned-area comparison.","scientific_use":"wildfire robustness analysis","original_object":{"target":"reported burned area","construct":"burned area for the registered selected-fire set","geographic_domain":"France","temporal_domain":"2022 fire season","support":"registered selected fires","event_universe":"selected fires used in the high-resolution comparison","unit":"ha","source_identity":"High-resolution estimate reported by Vallet et al. (2023)","version":"source version registered in the submission benchmark record"},"replacement_object":{"target":"reported burned area","construct":"EFFIS mapped burned area for the same selected-fire set","geographic_domain":"France","temporal_domain":"2022 fire season","support":"same registered selected fires","event_universe":"same selected-fire universe","unit":"ha","source_identity":"EFFIS matched-fire value reported by Vallet et al. (2023)","version":"source version registered in the submission benchmark record"},"required_relations":["same target","same event universe","compatible domain/time/support","commensurate unit"],"observed_relations":[{"relation":"event universe","state":"verified","evidence":"42,520-ha baseline and 48,330-ha EFFIS comparison refer to the same selected-fire universe in the registered submission benchmark registry case."},{"relation":"unit","state":"verified","evidence":"Both reported values are in hectares."}],"continuity_state":"same_question_preserved","pcae":{"necessity":1,"possibility":1,"interpretation":"Same-claim support guaranteed for the registered evidence relation."},"licensed_statement":"For the registered selected-fire universe, 48,330 / 42,520 = 1.136642, reported as 1.137; the robustness arithmetic may be interpreted for that same selected-fire claim.","prohibited_escalation":"Do not generalize this matched-fire comparison to an unrestricted whole-year or all-fire conclusion.","reason":"The claim-defining event universe is preserved.","minimal_repair":[],"downstream_consequence":"The matched comparison may proceed to numerical robustness interpretation.","provenance":{"baseline":"submission benchmark registry","source_keys":["Vallet et al. 2023","submission benchmark registry France ablation"],"source_versions":["version/date identified in the source record"],"source_hashes":[],"hash_status":"not_supplied"}},{"record_version":"SOCR-0.1","claim_id":"FR-B06b-WHOLE-YEAR","claim_requested":"The EFFIS whole-year value is stronger robustness evidence for the registered selected-fire comparison.","scientific_use":"wildfire robustness analysis","original_object":{"target":"reported burned area","construct":"burned area for the registered selected-fire set","geographic_domain":"France","temporal_domain":"2022 fire season","support":"registered selected fires","event_universe":"selected fires used in the high-resolution comparison","unit":"ha","source_identity":"High-resolution estimate reported by Vallet et al. (2023)","version":"source version registered in the submission benchmark record"},"replacement_object":{"target":"reported burned area","construct":"EFFIS whole-year burned area","geographic_domain":"France","temporal_domain":"2022 whole year","support":"whole-year reporting support","event_universe":"broader whole-year event set including events outside the matched selected-fire set","unit":"ha","source_identity":"EFFIS whole-year value reported by Vallet et al. (2023)","version":"source version registered in the submission benchmark record"},"required_relations":["same target","same event universe","compatible domain/time/support","commensurate unit"],"observed_relations":[{"relation":"event universe","state":"failed","evidence":"The 66,393-ha whole-year value contains a broader event set, including events outside the registered selected-fire universe."},{"relation":"unit","state":"verified","evidence":"Both values are reported in hectares."}],"continuity_state":"question_changed","pcae":{"necessity":0,"possibility":0,"interpretation":"Same-claim support is impossible for this candidate object under the registered selected-fire claim."},"licensed_statement":"The arithmetic 66,393 / 42,520 = 1.561453 (1.561) describes the supplied whole-year value relative to the selected-fire baseline, but it is not a robustness result for the same selected-fire claim.","prohibited_escalation":"Do not describe 1.561 as a stronger robustness effect for the original selected-fire claim.","reason":"The claim-defining event universe changed; numerical magnitude cannot compensate for that failed relation.","minimal_repair":[],"downstream_consequence":"The current candidate cannot be repaired by acquiring a missing evidence role. Use a candidate matched to the registered selected-fire universe or register a different scientific question.","provenance":{"baseline":"submission benchmark registry","source_keys":["Vallet et al. 2023","submission benchmark registry France ablation"],"source_versions":["version/date identified in the source record"],"source_hashes":[],"hash_status":"not_supplied"}},{"record_version":"SOCR-0.1","claim_id":"PT-COMMON-SUPPORT-J","claim_requested":"The separately admitted population/building and mapped-cover objects support a joint common-support statistic.","scientific_use":"environmental spatial composition","original_object":{"target":"population/building role P","construct":"official 2021 Census/BGRI population/building component","geographic_domain":"Portugal mainland","temporal_domain":"2021","support":"registered mainland subsection domain","event_universe":"registered BGRI parent domain","unit":"records/residents","source_identity":"Instituto Nacional de Estatística 2021","version":"source version registered in the submission benchmark record"},"replacement_object":{"target":"mapped-cover role K plus relation J","construct":"mapped cover combined with population on exact common support","geographic_domain":"Portugal mainland","temporal_domain":"2021/common registered period","support":"exact common spatial support required","event_universe":"joint P-K domain","unit":"declared joint statistic","source_identity":"COSc/BGRI joint relation as registered in submission benchmark registry","version":"source version registered in the submission benchmark record"},"required_relations":["P established","K established","common-support relation J established"],"observed_relations":[{"relation":"P","state":"verified","evidence":"Population/building role is registered as established for its bounded use."},{"relation":"K","state":"verified","evidence":"Mapped-cover role is registered as established for its bounded use."},{"relation":"J common support","state":"unresolved","evidence":"The exact common-support relation required for the joint claim remains unresolved in the registered example."}],"continuity_state":"pending_evidence","pcae":{"necessity":0,"possibility":1,"interpretation":"Joint support remains possible but is not guaranteed."},"licensed_statement":"The P and K components may be reported separately for their admitted meanings.","prohibited_escalation":"Do not report the joint population–mapped-cover overlap/co-location statistic until relation J is established.","reason":"A valid pair of component objects does not create their required common-support relation.","minimal_repair":[["J common-support relation"]],"downstream_consequence":"Acquire/verify J and rerun; do not substitute a proxy relation.","provenance":{"baseline":"submission benchmark registry","source_keys":["INE 2021","submission benchmark registry Portugal P-K-J example"],"source_versions":["version/date identified in the source record"],"source_hashes":[],"hash_status":"not_supplied"}},{"record_version":"SOCR-0.1","claim_id":"CASTELO-2026-EXPECTED-OUTCOME","claim_requested":"The prioritized municipal intervention has already reduced wildfire risk/protected the stated population or area.","scientific_use":"planning / reporting / downstream decision justification","original_object":{"target":"approved project plan","construct":"planned budget, intervention target, priority-map quantities and expected results","geographic_domain":"Castelo de Paiva, Portugal","temporal_domain":"2026 programme","support":"programme-level plan support","event_universe":"approved municipal project records","unit":"EUR / ha / plan targets","source_identity":"Programa Municipal de Execução 2026","version":"source version registered in the submission benchmark record"},"replacement_object":{"target":"realized outcome claim","construct":"post-intervention wildfire-risk reduction/effectiveness","geographic_domain":"Castelo de Paiva, Portugal","temporal_domain":"post-intervention period","support":"matched intervention/outcome support required","event_universe":"implemented intervention and outcome observations","unit":"outcome metric","source_identity":"not yet supplied as a matched outcome object","version":"source version registered in the submission benchmark record"},"required_relations":["approved plan facts","operative spatial relation where spatial claim is made","post-intervention outcome evidence","appropriate comparison/attribution for causal wording"],"observed_relations":[{"relation":"approved plan facts","state":"verified","evidence":"Budget/target/expected-result statements are present in the approved programme."},{"relation":"operative vector geometry","state":"unresolved","evidence":"Operative vector geometry is not materialized as a retained analysis object for segment-level inference."},{"relation":"realized outcome evidence","state":"unresolved","evidence":"No matched post-intervention outcome object is registered for a realized reduction claim."}],"continuity_state":"pending_evidence","pcae":{"necessity":0,"possibility":1,"interpretation":"Plan facts are established; stronger spatial/outcome inter